id,title,score,num_comments,author,created_utc,url,over_18,edited,spoiler,stickied
1ce0ohq,Why do companies use Snowflake if it is that expensive as people say ? ,155,109,Normal-Inspector7866,2024-04-27 00:04:14,https://www.reddit.com/r/dataengineering/comments/1ce0ohq/why_do_companies_use_snowflake_if_it_is_that/,False,False,False,False
1cebzub,Spark streaming is expensive ,14,12,Foreign-One-2408,2024-04-27 11:08:09,https://www.reddit.com/r/dataengineering/comments/1cebzub/spark_streaming_is_expensive/,False,False,False,False
1cdodnu,Is Snowflake micro-partitions a rebranding or Parquet row-groups?,10,6,royondata,2024-04-26 15:31:33,https://www.reddit.com/r/dataengineering/comments/1cdodnu/is_snowflake_micropartitions_a_rebranding_or/,False,False,False,False
1cds5yo,Would it be cringe to connect with people on LinkedIn?,10,42,Single-Sound-1865,2024-04-26 18:04:57,https://www.reddit.com/r/dataengineering/comments/1cds5yo/would_it_be_cringe_to_connect_with_people_on/,False,False,False,False
1cdx354,Devops Engineer or Data Engineer Career choice,8,15,Wild_Manufacturer105,2024-04-26 21:25:46,https://www.reddit.com/r/dataengineering/comments/1cdx354/devops_engineer_or_data_engineer_career_choice/,False,False,False,False
1cdrhdu,3NF and dimensional modeling ,8,11,yeykawb,2024-04-26 17:37:07,https://www.reddit.com/r/dataengineering/comments/1cdrhdu/3nf_and_dimensional_modeling/,False,False,False,False
1cdvxow,My videography business' file storage is getting really expensive. Any ideas on reducing costs for someone who's not tech-savvy?,6,18,PianoCharged,2024-04-26 20:38:35,https://www.reddit.com/r/dataengineering/comments/1cdvxow/my_videography_business_file_storage_is_getting/,False,False,False,False
1cdqz5r,Python vs Bash as a glue language: what are the pros and cons? And which one do you use?,7,18,knightfall0,2024-04-26 17:16:30,https://www.reddit.com/r/dataengineering/comments/1cdqz5r/python_vs_bash_as_a_glue_language_what_are_the/,False,False,False,False
1cebfpy,How do you tokenize data in your organization?,4,4,tuannmdo,2024-04-27 10:32:08,https://www.reddit.com/r/dataengineering/comments/1cebfpy/how_do_you_tokenize_data_in_your_organization/,False,False,False,False
1ceapul,Snowflake Iceberg Tables on Cloudflare R2,3,1,Pbd1194,2024-04-27 09:45:00,https://www.reddit.com/r/dataengineering/comments/1ceapul/snowflake_iceberg_tables_on_cloudflare_r2/,False,False,False,False
1cdudj9,I don’t know if it’s enough for a first job…,4,3,Puzzleheaded-Sun3107,2024-04-26 19:35:58,https://www.reddit.com/r/dataengineering/comments/1cdudj9/i_dont_know_if_its_enough_for_a_first_job/,False,False,False,False
1cdq1cp,LLMs are Commoditized; Data is the Differentiator,5,1,something_cleverer,2024-04-26 16:38:20,https://postgresml.org/blog/llms-are-commoditized-data-is-the-differentiator,False,False,False,False
1cdxnbv,Two Things to Keep in Mind Before You Start Building Another Database System,3,0,dmagda7817,2024-04-26 21:48:58,https://medium.com/@magda7817/two-things-to-keep-in-mind-before-you-start-building-another-database-system-47991974fa0f,False,False,False,False
1cds2vy,What is your favorite Postgres extension and why?,3,6,AMDataLake,2024-04-26 18:01:32,https://www.reddit.com/r/dataengineering/comments/1cds2vy/what_is_your_favorite_postgres_extension_and_why/,False,False,False,False
1cdr3zx,Reving Warehouse DDL,3,1,ReporterNervous6822,2024-04-26 17:21:58,https://www.reddit.com/r/dataengineering/comments/1cdr3zx/reving_warehouse_ddl/,False,False,False,False
1cdr2va,Using DBT Expectations for a FK check,3,4,slcgayoutdoors,2024-04-26 17:20:45,https://www.reddit.com/r/dataengineering/comments/1cdr2va/using_dbt_expectations_for_a_fk_check/,False,False,False,False
1cee349,Best Approach for Backing Up Delta Tables,2,0,dead_pool1036,2024-04-27 13:05:09,https://www.reddit.com/r/dataengineering/comments/1cee349/best_approach_for_backing_up_delta_tables/,False,False,False,False
1cecx9k,Join my New Streaming Show to Share Your Data Engineering Experiences!,5,6,geoheil,2024-04-27 12:02:58,https://www.reddit.com/r/dataengineering/comments/1cecx9k/join_my_new_streaming_show_to_share_your_data/,False,False,False,False
1ce7ly4,"What do you think about a company using informatica cloud, snowflake , palantir foundry? ",2,6,sneekeeei,2024-04-27 06:18:46,https://www.reddit.com/r/dataengineering/comments/1ce7ly4/what_do_you_think_about_a_company_using/,False,False,False,False
1cdybju,Databricks Architecture: Data Plane and control plane,2,1,Extra-Cancel3086,2024-04-26 22:17:44,https://www.reddit.com/r/dataengineering/comments/1cdybju/databricks_architecture_data_plane_and_control/,False,False,False,False
1cdxdh4,Databricks Architecture: Control plane and data plane,3,0,Extra-Cancel3086,2024-04-26 21:37:44,https://www.reddit.com/r/dataengineering/comments/1cdxdh4/databricks_architecture_control_plane_and_data/,False,False,False,False
1cdurxf,"""Defer to Prod"" concept",2,4,Ownards,2024-04-26 19:52:35,https://www.reddit.com/r/dataengineering/comments/1cdurxf/defer_to_prod_concept/,False,False,False,False
1cefbzm,How does this job translate into Data Engineering skills?,2,4,DarkPaladin67,2024-04-27 14:06:48,https://www.reddit.com/r/dataengineering/comments/1cefbzm/how_does_this_job_translate_into_data_engineering/,False,False,False,False
1cedswa,How to approach this project?,1,1,mirubiri,2024-04-27 12:51:09,https://www.reddit.com/r/dataengineering/comments/1cedswa/how_to_approach_this_project/,False,False,False,False
1ce2ojv,Delta Live Tables for Gold Layer,1,1,Mr_Nickster_,2024-04-27 01:42:16,https://www.reddit.com/r/dataengineering/comments/1ce2ojv/delta_live_tables_for_gold_layer/,False,False,False,False
1cdwlww,AI/ML for data engineering ,1,2,Jkk_geek,2024-04-26 21:06:05,https://www.reddit.com/r/dataengineering/comments/1cdwlww/aiml_for_data_engineering/,False,False,False,False
1cdwj1d,"Need Advice: ""AI-driven"" Excel Template Converter",1,0,whyAlwaysAi,2024-04-26 21:02:50,https://www.reddit.com/r/dataengineering/comments/1cdwj1d/need_advice_aidriven_excel_template_converter/,False,False,False,False
1cdnvfi,HOT updates in PostgreSQL for better performance,1,1,theporterhaus,2024-04-26 15:10:40,https://www.cybertec-postgresql.com/en/hot-updates-in-postgresql-for-better-performance/,False,False,False,False
1cdod9o,How good programing skills does one need to get into DE? I am pursuing Cloud Computing PG. ,0,2,Guilty-Direction-808,2024-04-26 15:31:07,https://www.reddit.com/r/dataengineering/comments/1cdod9o/how_good_programing_skills_does_one_need_to_get/,False,False,False,False
